{
  "reconciliationSchema": "ibex/capsec-legacy-reconciliation/1",
  "profile": "ibex/capsec/1",
  "source": "src/host/capability_bits.rs",
  "entries": [
    {
      "legacyCapability": "network:fetch",
      "destinationDisposition": "authorable",
      "migrationKind": "direct",
      "replacementActions": ["network:fetch"],
      "currentStatus": "partial",
      "resourceSemantics": "Typed fetch endpoint with scheme, canonical host kind, materialized port, direct route, peer classes, selected candidate, and verified peer.",
      "rationale": "The current check covers only a lowercased requested hostname; WP6 must add staged peer, redirect, reconnect, and route checks."
    },
    {
      "legacyCapability": "network:connect",
      "destinationDisposition": "authorable",
      "migrationKind": "direct",
      "replacementActions": ["network:connect"],
      "currentStatus": "partial",
      "resourceSemantics": "Typed raw or bidirectional endpoint with transport, canonical host, exact or bounded port, route, peer classes, and verified peer.",
      "rationale": "TCP, UDP, WebSocket, and similar transports remain separate from sealed fetch authority."
    },
    {
      "legacyCapability": "network:listen",
      "destinationDisposition": "authorable",
      "migrationKind": "direct",
      "replacementActions": ["network:listen"],
      "currentStatus": "partial",
      "resourceSemantics": "Typed internet or Unix bind resource with transport, interface/address class, and exact, bounded, or explicit ephemeral port.",
      "rationale": "The current host:port string does not capture dual-stack, interface, Unix path, accepted-peer, or cleanup semantics."
    },
    {
      "legacyCapability": "network:local",
      "destinationDisposition": "non-capability",
      "migrationKind": "decompose",
      "replacementActions": ["network:connect", "network:listen"],
      "currentStatus": "partial",
      "resourceSemantics": "Unix-domain operations emit typed connect or listen plus applicable fs:list and fs:write effects for pathname sockets.",
      "rationale": "The legacy token conflates outbound and inbound authority and lowercases case-sensitive Unix paths."
    },
    {
      "legacyCapability": "fs:read",
      "destinationDisposition": "authorable",
      "migrationKind": "direct",
      "replacementActions": ["fs:read"],
      "currentStatus": "partial",
      "resourceSemantics": "Logical-root path-exact or path-tree selector; the occurrence binds follow mode and the retained or verified object identity actually read.",
      "rationale": "The existing symlink normalization is retained only as input to checked-object execution, not as a check-then-reopen guarantee."
    },
    {
      "legacyCapability": "fs:write",
      "destinationDisposition": "authorable",
      "migrationKind": "direct",
      "replacementActions": ["fs:write"],
      "currentStatus": "partial",
      "resourceSemantics": "Logical-root exact/tree path with verified parent and target identities at each mutation stage.",
      "rationale": "Multi-path and metadata operations must authorize all list/write effects before mutation."
    },
    {
      "legacyCapability": "fs:list",
      "destinationDisposition": "authorable",
      "migrationKind": "direct",
      "replacementActions": ["fs:list"],
      "currentStatus": "folded",
      "resourceSemantics": "Exact/tree metadata and existence-disclosure authority, independent of byte reads.",
      "rationale": "The bit is currently inert because stat, readdir, and existence disclosure are folded into fs:read."
    },
    {
      "legacyCapability": "fs:watch",
      "destinationDisposition": "authorable",
      "migrationKind": "direct",
      "replacementActions": ["fs:watch"],
      "currentStatus": "folded",
      "resourceSemantics": "Exact/tree live observation with owner, source, generation, and delivery rechecks.",
      "rationale": "The bit is currently inert and polling watch behavior is folded into fs:read."
    },
    {
      "legacyCapability": "env:read",
      "destinationDisposition": "authorable",
      "migrationKind": "direct",
      "replacementActions": ["env:read"],
      "currentStatus": "partial",
      "resourceSemantics": "One exact environment name and effect-owner namespace; enumeration emits one effect per name.",
      "rationale": "The canonical format forbids the current positive * name and separates broker base values from principal overlays."
    },
    {
      "legacyCapability": "process:spawn",
      "destinationDisposition": "authorable",
      "migrationKind": "direct",
      "replacementActions": ["process:spawn"],
      "currentStatus": "partial",
      "resourceSemantics": "Terminal static-only executable identity including logical name, retained path/object, content digest, and interpreter; child env, stdio, cwd, and filesystem effects are conjunctive.",
      "rationale": "The current resource-less grant covers every executable and launch option and cannot survive into canonical policy."
    },
    {
      "legacyCapability": "process:signal",
      "destinationDisposition": "closed",
      "migrationKind": "close",
      "replacementActions": ["process:signal"],
      "currentStatus": "partial",
      "resourceSemantics": "Future semantics require an explicit target class and signal set, with inspector activation conjunctively checked where applicable.",
      "rationale": "Arbitrary signaling is shared-process mutation and remains deny-only in the initial profile."
    },
    {
      "legacyCapability": "process:cwd",
      "destinationDisposition": "closed",
      "migrationKind": "close",
      "replacementActions": ["process:cwd"],
      "currentStatus": "partial",
      "resourceSemantics": "Shared process current-directory mutation has no positive selector in the initial profile.",
      "rationale": "Keep closed unless cwd is virtualized or scoped without changing other principals' resolution."
    },
    {
      "legacyCapability": "device:location",
      "destinationDisposition": "authorable",
      "migrationKind": "direct",
      "replacementActions": ["device:location"],
      "currentStatus": "manifest-only",
      "resourceSemantics": "One typed location action with explicit foreground/background usage and coarse/precise precision.",
      "rationale": "The broad legacy prefix must not silently imply every present or future location qualifier."
    },
    {
      "legacyCapability": "device:location:whenInUse",
      "destinationDisposition": "authorable",
      "migrationKind": "alias",
      "replacementActions": ["device:location"],
      "currentStatus": "partial",
      "resourceSemantics": "Typed device-location selector with usage foreground and explicit precision.",
      "rationale": "Android current-location calls already check this legacy spelling; canonical policy uses the typed base action."
    },
    {
      "legacyCapability": "device:location:always",
      "destinationDisposition": "absent",
      "migrationKind": "alias",
      "replacementActions": ["device:location"],
      "currentStatus": "manifest-only",
      "resourceSemantics": "Reserved typed device-location selector with usage background.",
      "rationale": "No background-authority surface or enforcing gate exists, so target cells must prove a future implementation before authoring it."
    },
    {
      "legacyCapability": "device:location:precise",
      "destinationDisposition": "authorable",
      "migrationKind": "alias",
      "replacementActions": ["device:location"],
      "currentStatus": "partial",
      "resourceSemantics": "Typed device-location selector with precision precise; Android high-accuracy acquisition also requires foreground usage.",
      "rationale": "Precision is a resource predicate, not a third colon-delimited action segment."
    },
    {
      "legacyCapability": "device:location:reduced",
      "destinationDisposition": "non-capability",
      "migrationKind": "retire",
      "replacementActions": ["device:location"],
      "currentStatus": "manifest-only",
      "resourceSemantics": "Coarse precision is an attenuation/status value on device:location.",
      "rationale": "Reduced accuracy grants no independent authority and must not become a separate positive action."
    },
    {
      "legacyCapability": "device:camera",
      "destinationDisposition": "authorable",
      "migrationKind": "direct",
      "replacementActions": ["device:camera"],
      "currentStatus": "partial",
      "resourceSemantics": "Typed facing/device selection and photo/video operation class, with broker generation and resolved device identity in occurrences.",
      "rationale": "The current Android base gate ignores public front/back/external distinctions; target cells remain unsupported until the native boundary preserves them."
    },
    {
      "legacyCapability": "device:microphone",
      "destinationDisposition": "unsupported",
      "migrationKind": "close",
      "replacementActions": ["device:microphone"],
      "currentStatus": "ungated",
      "resourceSemantics": "Typed audio capture and optional device identity.",
      "rationale": "Capture APIs exist but no complete Ibex native effect gate protects actual recording yet."
    },
    {
      "legacyCapability": "device:photos",
      "destinationDisposition": "absent",
      "migrationKind": "retire",
      "replacementActions": [],
      "currentStatus": "manifest-only",
      "resourceSemantics": "No aggregate positive action; future read and write resources must be explicit.",
      "rationale": "The legacy base string silently implies read, write, and limited status."
    },
    {
      "legacyCapability": "device:photos:read",
      "destinationDisposition": "absent",
      "migrationKind": "retire",
      "replacementActions": [],
      "currentStatus": "manifest-only",
      "resourceSemantics": "Future typed library or user-selected collection read resource.",